{
  "$schema": "./profiles.schema.json",
  "schemaVersion": 1,
  "countries": {
    "BR": {
      "name": "Brazil",
      "localName": "Brasil"
    },
    "CH": {
      "name": "Switzerland",
      "localName": "Schweiz"
    },
    "DE": {
      "name": "Germany",
      "localName": "Deutschland"
    },
    "GB": {
      "name": "United Kingdom",
      "localName": "United Kingdom"
    },
    "LU": {
      "name": "Luxembourg",
      "localName": "Lëtzebuerg"
    },
    "NL": {
      "name": "Netherlands",
      "localName": "Nederland"
    },
    "NO": {
      "name": "Norway",
      "localName": "Norge"
    },
    "PT": {
      "name": "Portugal",
      "localName": "Portugal"
    }
  },
  "providers": {
    "bt": {
      "name": "BT",
      "countries": [
        "GB"
      ],
      "profiles": [
        "bt"
      ],
      "ptrSuffixes": [
        "btcentralplus.com"
      ],
      "asns": [
        "AS2856"
      ]
    },
    "freedom": {
      "name": "Freedom Internet",
      "countries": [
        "NL"
      ],
      "profiles": [
        "kpn"
      ],
      "ptrSuffixes": [
        "freedom.nl"
      ],
      "asns": [
        "AS206238"
      ]
    },
    "init7": {
      "name": "Init7",
      "countries": [
        "CH"
      ],
      "profiles": [
        "init7"
      ],
      "ptrSuffixes": [
        "init7.net"
      ],
      "asns": [
        "AS13030",
        "AS16221"
      ]
    },
    "kpn": {
      "name": "KPN",
      "countries": [
        "NL"
      ],
      "profiles": [
        "kpn"
      ],
      "ptrSuffixes": [
        "kpn.net"
      ],
      "asns": [
        "AS1136",
        "AS21286",
        "AS12871",
        "AS8737",
        "AS197727",
        "AS2043"
      ]
    },
    "magentatv": {
      "name": "Telekom MagentaTV",
      "countries": [
        "DE"
      ],
      "profiles": [
        "magentatv"
      ],
      "asns": [
        "AS3320"
      ]
    },
    "meo": {
      "name": "MEO",
      "countries": [
        "PT"
      ],
      "profiles": [
        "meo"
      ],
      "asns": [
        "AS8657",
        "AS15525",
        "AS3243",
        "AS42863"
      ]
    },
    "posttv": {
      "name": "POST Luxembourg",
      "countries": [
        "LU"
      ],
      "profiles": [
        "posttv"
      ],
      "asns": [
        "AS6661"
      ]
    },
    "solcon": {
      "name": "Solcon",
      "countries": [
        "NL"
      ],
      "profiles": [
        "solcon"
      ],
      "ptrSuffixes": [
        "solcon.nl"
      ],
      "asns": [
        "AS12414"
      ]
    },
    "swisscom": {
      "name": "Swisscom",
      "countries": [
        "CH"
      ],
      "profiles": [
        "swisscom"
      ],
      "ptrSuffixes": [
        "bluewin.ch"
      ],
      "asns": [
        "AS3303",
        "AS8300",
        "AS21273",
        "AS60633"
      ]
    },
    "telenor": {
      "name": "Telenor",
      "countries": [
        "NO"
      ],
      "profiles": [
        "telenor"
      ],
      "asns": [
        "AS2119",
        "AS197943",
        "AS200168"
      ]
    },
    "tweak": {
      "name": "Tweak",
      "countries": [
        "NL"
      ],
      "profiles": [
        "tweak"
      ],
      "ptrSuffixes": [
        "tweak.nl"
      ]
    },
    "vivo": {
      "name": "Vivo",
      "countries": [
        "BR"
      ],
      "profiles": [
        "vivo",
        "vivogvt"
      ],
      "asns": [
        "AS27699",
        "AS18881",
        "AS26599",
        "AS10429",
        "AS11419",
        "AS11706",
        "AS19182",
        "AS272264"
      ]
    },
    "xs4all": {
      "name": "XS4ALL",
      "countries": [
        "NL"
      ],
      "profiles": [
        "kpn"
      ],
      "ptrSuffixes": [
        "xs4all.nl"
      ]
    }
  },
  "profiles": {
    "bt": {
      "name": "BT IPTV",
      "wan": {
        "vlan": 0,
        "dhcp": false,
        "staticAddress": "10.20.30.1/24",
        "natDestinations": [
          "109.159.247.0/24"
        ]
      },
      "sourceRanges": [
        "109.159.247.0/24"
      ]
    },
    "init7": {
      "name": "Init7 TV7",
      "wan": {
        "vlan": 0,
        "dhcp": false,
        "natDestinations": [
          "77.109.128.0/19"
        ]
      },
      "sourceRanges": [
        "77.109.128.0/19"
      ]
    },
    "kpn": {
      "name": "KPN network",
      "wan": {
        "vlan": 4,
        "dhcp": true,
        "dhcpOptions": [
          "-O",
          "staticroutes",
          "-V",
          "IPTV_RG"
        ],
        "natDestinations": [
          "213.75.0.0/16",
          "217.166.0.0/16",
          "195.121.0.0/16"
        ]
      },
      "sourceRanges": [
        "213.75.0.0/16",
        "217.166.0.0/16",
        "195.121.0.0/16"
      ]
    },
    "magentatv": {
      "name": "MagentaTV",
      "wan": {
        "interface": "ppp0",
        "vlan": 0,
        "dhcp": false,
        "natDestinations": [
          "87.141.0.0/16",
          "193.158.0.0/15"
        ]
      },
      "sourceRanges": [
        "87.141.0.0/16",
        "193.158.0.0/15"
      ]
    },
    "meo": {
      "name": "MEO IPTV",
      "wan": {
        "vlan": 0,
        "dhcp": false,
        "natDestinations": [
          "10.159.0.0/16",
          "10.173.0.0/16",
          "194.65.46.0/23",
          "213.13.16.0/20"
        ]
      },
      "sourceRanges": [
        "10.159.0.0/16",
        "10.173.0.0/16",
        "194.65.46.0/23",
        "213.13.16.0/20"
      ]
    },
    "posttv": {
      "name": "PostTV",
      "wan": {
        "interface": "eth8.35",
        "vlan": 0,
        "dhcp": false,
        "staticAddress": "10.10.10.10/32",
        "natDestinations": [
          "172.19.9.0/24"
        ]
      },
      "sourceRanges": [
        "172.19.9.0/24"
      ]
    },
    "solcon": {
      "name": "Solcon IPTV",
      "wan": {
        "vlan": 4,
        "dhcp": true,
        "dhcpOptions": [
          "-O",
          "staticroutes",
          "-V",
          "IPTV_RG"
        ],
        "natDestinations": [
          "10.0.0.0/8",
          "10.252.0.0/16",
          "10.253.0.0/16",
          "217.166.0.0/16"
        ]
      },
      "sourceRanges": [
        "10.0.0.0/8",
        "10.252.0.0/16",
        "10.253.0.0/16",
        "217.166.0.0/16"
      ]
    },
    "swisscom": {
      "name": "Swisscom TV",
      "wan": {
        "vlan": 0,
        "dhcp": false,
        "natDestinations": [
          "195.186.0.0/16",
          "213.3.72.0/24"
        ]
      },
      "sourceRanges": [
        "195.186.0.0/16",
        "213.3.72.0/24"
      ]
    },
    "telenor": {
      "name": "Telenor T-We",
      "wan": {
        "vlan": 0,
        "dhcp": false,
        "natDestinations": [
          "93.91.111.0/24",
          "148.122.7.125/32"
        ]
      },
      "sourceRanges": [
        "93.91.111.0/24",
        "148.122.7.125/32"
      ]
    },
    "tweak": {
      "name": "Tweak IPTV",
      "wan": {
        "vlan": 4,
        "dhcp": true,
        "dhcpOptions": [
          "-O",
          "staticroutes"
        ],
        "natDestinations": [
          "0.0.0.0/0"
        ]
      },
      "sourceRanges": [
        "0.0.0.0/0"
      ]
    },
    "vivo": {
      "name": "São Paulo network",
      "note": "IPTV DNS servers: 177.16.30.67 and 177.16.30.7.",
      "wan": {
        "vlan": 20,
        "dhcp": true,
        "dhcpOptions": [
          "-O",
          "staticroutes",
          "-V",
          "IPTV_RG"
        ],
        "natDestinations": [
          "172.28.0.0/14",
          "201.0.52.0/23",
          "200.161.71.0/24",
          "177.16.0.0/16"
        ]
      },
      "sourceRanges": [
        "172.28.0.0/14",
        "201.0.52.0/23",
        "200.161.71.0/24",
        "177.16.0.0/16"
      ]
    },
    "vivogvt": {
      "name": "GVT network",
      "note": "IPTV DNS servers: 177.16.30.67 and 177.16.30.7.",
      "wan": {
        "vlan": 4000,
        "dhcp": false,
        "staticAddress": "10.0.0.1/32",
        "natDestinations": [
          "0.0.0.0/0"
        ]
      },
      "sourceRanges": [
        "0.0.0.0/0"
      ]
    }
  }
}
